{
  "schema_version": 1,
  "nodes": [
    {
      "id": "n0",
      "position": {
        "x": 0.0,
        "y": 0.0
      },
      "attributes": {
        "degree": 1,
        "junction_hint": "dead_end",
        "hd": {
          "vertical_model": "unknown",
          "elevation_m": null
        }
      }
    },
    {
      "id": "n1",
      "position": {
        "x": 15.0,
        "y": 0.7
      },
      "attributes": {
        "degree": 1,
        "junction_hint": "dead_end",
        "hd": {
          "vertical_model": "unknown",
          "elevation_m": null
        }
      }
    },
    {
      "id": "n2",
      "position": {
        "x": 50.0,
        "y": 1.0
      },
      "attributes": {
        "degree": 1,
        "junction_hint": "dead_end",
        "hd": {
          "vertical_model": "unknown",
          "elevation_m": null
        }
      }
    },
    {
      "id": "n3",
      "position": {
        "x": 65.0,
        "y": 1.0
      },
      "attributes": {
        "degree": 1,
        "junction_hint": "dead_end",
        "hd": {
          "vertical_model": "unknown",
          "elevation_m": null
        }
      }
    }
  ],
  "edges": [
    {
      "id": "e0",
      "start_node_id": "n0",
      "end_node_id": "n1",
      "polyline": [
        {
          "x": 0.0,
          "y": 0.0
        },
        {
          "x": 6.154415622893875e-20,
          "y": 2.4617662491575504e-21
        },
        {
          "x": 3.7111273274565504e-15,
          "y": 1.4844509309826203e-16
        },
        {
          "x": 2.237818646622747e-10,
          "y": 8.951274586490988e-12
        },
        {
          "x": 1.3494063497550494e-05,
          "y": 5.397625399020198e-07
        },
        {
          "x": 0.6998106253234949,
          "y": 0.0279924250129398
        },
        {
          "x": 4.999490535688106,
          "y": 0.19997962142752423
        },
        {
          "x": 4.999999991550345,
          "y": 0.1999999996620138
        },
        {
          "x": 4.99999999999986,
          "y": 0.1999999999999944
        },
        {
          "x": 5.0,
          "y": 0.2
        },
        {
          "x": 5.0,
          "y": 0.2
        },
        {
          "x": 5.0,
          "y": 0.20000000000000004
        },
        {
          "x": 5.0,
          "y": 0.2
        },
        {
          "x": 5.000000000005448,
          "y": 0.20000000000032692
        },
        {
          "x": 5.000000332151312,
          "y": 0.20000001992907876
        },
        {
          "x": 5.020168332597409,
          "y": 0.20121009995584457
        },
        {
          "x": 9.979831667402589,
          "y": 0.49878990004415535
        },
        {
          "x": 9.999999667848689,
          "y": 0.4999999800709213
        },
        {
          "x": 9.999999999994552,
          "y": 0.49999999999967315
        },
        {
          "x": 10.0,
          "y": 0.5
        },
        {
          "x": 10.0,
          "y": 0.5
        },
        {
          "x": 10.0,
          "y": 0.5
        },
        {
          "x": 10.0,
          "y": 0.5
        },
        {
          "x": 10.000000000000139,
          "y": 0.5000000000000057
        },
        {
          "x": 10.000000008449655,
          "y": 0.5000000003379862
        },
        {
          "x": 10.000509464311893,
          "y": 0.5000203785724757
        },
        {
          "x": 14.300189374676497,
          "y": 0.6720075749870598
        },
        {
          "x": 14.999986505936501,
          "y": 0.6999994602374601
        },
        {
          "x": 14.999999999776216,
          "y": 0.6999999999910487
        },
        {
          "x": 14.999999999999996,
          "y": 0.6999999999999997
        },
        {
          "x": 15.000000000000002,
          "y": 0.7
        },
        {
          "x": 15.0,
          "y": 0.7
        }
      ],
      "attributes": {
        "kind": "lane_centerline",
        "source": "trajectory_mvp",
        "hd": {
          "tier": "sd_seed",
          "target_tier": "hd",
          "lane_boundaries": {
            "left": [
              {
                "x": 0.0,
                "y": 1.75
              },
              {
                "x": 2.0,
                "y": 1.75
              },
              {
                "x": 4.0,
                "y": 1.75
              },
              {
                "x": 6.0,
                "y": 1.75
              },
              {
                "x": 8.0,
                "y": 1.75
              },
              {
                "x": 10.0,
                "y": 1.75
              },
              {
                "x": 12.0,
                "y": 1.75
              },
              {
                "x": 14.0,
                "y": 1.75
              },
              {
                "x": 17.0,
                "y": 1.75
              }
            ],
            "right": [
              {
                "x": 0.0,
                "y": -1.75
              },
              {
                "x": 2.0,
                "y": -1.75
              },
              {
                "x": 4.0,
                "y": -1.75
              },
              {
                "x": 6.0,
                "y": -1.75
              },
              {
                "x": 8.0,
                "y": -1.75
              },
              {
                "x": 10.0,
                "y": -1.75
              },
              {
                "x": 12.0,
                "y": -1.75
              },
              {
                "x": 14.0,
                "y": -1.75
              },
              {
                "x": 17.0,
                "y": -1.75
              }
            ]
          },
          "semantic_rules": [
            {
              "edge_id": "e0",
              "kind": "speed_limit",
              "value_kmh": 50
            },
            {
              "edge_id": "e0",
              "kind": "traffic_light",
              "confidence": 0.82
            }
          ],
          "quality": "lidar_binned_median",
          "note": "Boundaries from XY points near centerline (binned median); not survey-grade."
        }
      }
    },
    {
      "id": "e1",
      "start_node_id": "n2",
      "end_node_id": "n3",
      "polyline": [
        {
          "x": 50.0,
          "y": 1.0
        },
        {
          "x": 50.0,
          "y": 1.0
        },
        {
          "x": 50.00000000000001,
          "y": 1.0000000000000002
        },
        {
          "x": 50.00000000022139,
          "y": 1.000000000004428
        },
        {
          "x": 50.00001336981832,
          "y": 1.0000002673963664
        },
        {
          "x": 50.695135903597546,
          "y": 1.0139027180719509
        },
        {
          "x": 54.99948730204795,
          "y": 1.099989746040959
        },
        {
          "x": 54.99999999150912,
          "y": 1.0999999998301826
        },
        {
          "x": 54.99999999999986,
          "y": 1.0999999999999972
        },
        {
          "x": 55.0,
          "y": 1.1
        },
        {
          "x": 55.0,
          "y": 1.1
        },
        {
          "x": 55.0,
          "y": 1.1
        },
        {
          "x": 55.0,
          "y": 1.1
        },
        {
          "x": 55.00000000000577,
          "y": 1.1000000000001156
        },
        {
          "x": 55.0000003486159,
          "y": 1.1000000069723181
        },
        {
          "x": 55.020964093251074,
          "y": 1.1004192818650216
        },
        {
          "x": 59.98041241606815,
          "y": 1.199608248321363
        },
        {
          "x": 59.99999967436437,
          "y": 1.1999999934872871
        },
        {
          "x": 59.999999999994614,
          "y": 1.1999999999998923
        },
        {
          "x": 60.0,
          "y": 1.2
        },
        {
          "x": 60.0,
          "y": 1.2
        },
        {
          "x": 60.0,
          "y": 1.2
        },
        {
          "x": 60.0,
          "y": 1.2
        },
        {
          "x": 60.00000000000014,
          "y": 1.1999999999999942
        },
        {
          "x": 60.00000000867983,
          "y": 1.1999999996528072
        },
        {
          "x": 60.00052757600507,
          "y": 1.1999788969597975
        },
        {
          "x": 64.32567017779765,
          "y": 1.026973192888094
        },
        {
          "x": 64.99998717764853,
          "y": 1.0000005128940588
        },
        {
          "x": 64.99999999978905,
          "y": 1.0000000000084373
        },
        {
          "x": 65.0,
          "y": 1.0000000000000002
        },
        {
          "x": 65.0,
          "y": 1.0
        },
        {
          "x": 65.0,
          "y": 1.0
        }
      ],
      "attributes": {
        "kind": "lane_centerline",
        "source": "trajectory_mvp",
        "hd": {
          "tier": "sd_seed",
          "target_tier": "hd",
          "lane_boundaries": {
            "left": [
              {
                "x": 46.0,
                "y": 1.75
              },
              {
                "x": 48.0,
                "y": 1.75
              },
              {
                "x": 50.0,
                "y": 1.75
              }
            ],
            "right": [
              {
                "x": 46.0,
                "y": -1.75
              },
              {
                "x": 48.0,
                "y": -1.75
              },
              {
                "x": 50.0,
                "y": -1.75
              }
            ]
          },
          "semantic_rules": [],
          "quality": "lidar_binned_median",
          "note": "Boundaries from XY points near centerline (binned median); not survey-grade."
        }
      }
    }
  ],
  "metadata": {
    "sd_to_hd": {
      "pipeline_version": "0.2",
      "status": "centerline_boundaries_hd_lite",
      "stages_completed": [
        "attach_hd_attribute_slots",